{
  "caption": {
    "en": "Bluff share of the betting range = s/(1+2s), so value:bluff = (1+s)/s. One third pot -> 4:1, pot -> 2:1. The classic mistake is reading the MDF column as this ratio.",
    "zh": "诈唬占下注范围的比例 = s/(1+2s)，于是 价值:诈唬 = (1+2s)/s ... 化简为 (1+s)/s。1/3 池 -> 4:1，底池 -> 2:1。常见错误是把 MDF 那一列当成比例列。"
  },
  "checks": [
    {
      "detail": "generated column vs pokergto.odds.value_to_bluff_ratio",
      "kind": "ev_matches_direct_calculation",
      "pass": false,
      "tol": 1e-09
    }
  ],
  "columns": [
    {
      "header": {
        "en": "Size",
        "zh": "尺度"
      },
      "key": "size_label",
      "unit": "dimensionless"
    },
    {
      "digits": 2,
      "header": {
        "en": "Bluff share of betting range",
        "zh": "诈唬占比"
      },
      "key": "bluff_fraction",
      "unit": "probability"
    },
    {
      "digits": 3,
      "header": {
        "en": "Value : bluff",
        "zh": "价值:诈唬"
      },
      "key": "value_to_bluff",
      "unit": "ratio"
    }
  ],
  "id": "table.02-04.bluff-value-ratio",
  "lesson": "02-04",
  "markdown": null,
  "provenance": {
    "assumptions": [],
    "confidence": "high",
    "derivation_ref": "pokergto.odds#bluff_fraction_at_indifference",
    "kind": "derived",
    "license": "CC-BY-SA-4.0",
    "solver_run": null,
    "upstream": null,
    "verified": true
  },
  "rows": [
    {
      "bluff_fraction": 0.166667,
      "closed_form": 5.0,
      "size_label": "1/4 pot",
      "value_to_bluff": 5.0
    },
    {
      "bluff_fraction": 0.2,
      "closed_form": 4.000003000003,
      "size_label": "1/3 pot",
      "value_to_bluff": 4.0
    },
    {
      "bluff_fraction": 0.25,
      "closed_form": 3.0,
      "size_label": "1/2 pot",
      "value_to_bluff": 3.0
    },
    {
      "bluff_fraction": 0.285714,
      "closed_form": 2.49999925,
      "size_label": "2/3 pot",
      "value_to_bluff": 2.5
    },
    {
      "bluff_fraction": 0.3,
      "closed_form": 2.333333333333,
      "size_label": "3/4 pot",
      "value_to_bluff": 2.333333
    },
    {
      "bluff_fraction": 0.333333,
      "closed_form": 2.0,
      "size_label": "1x pot",
      "value_to_bluff": 2.0
    },
    {
      "bluff_fraction": 0.375,
      "closed_form": 1.666666666667,
      "size_label": "3/2 pot",
      "value_to_bluff": 1.666667
    },
    {
      "bluff_fraction": 0.4,
      "closed_form": 1.5,
      "size_label": "2x pot",
      "value_to_bluff": 1.5
    }
  ],
  "schema_version": "1.0.0",
  "source": {
    "args": {},
    "function": "sizing_table",
    "generator": "tools/gen_tables.py",
    "module": "pokergto.odds",
    "seed": null
  },
  "title": {
    "en": "Value-to-bluff ratio",
    "zh": "价值:诈唬 比例"
  },
  "unverified_claims": []
}
