{
  "caption": {
    "en": "The ranges are illustrative inputs (reference); each range's best holding, the board's reachable ceiling and the capped verdict are computed combo by combo (derived). The ceiling is the best over the combos that can still be dealt (1,176 on a flop, 1,081 once the board is full), so capped means not-in-my-range, not not-possible-on-this-board. A combo holding a card the board already shows cannot be dealt and is excluded -- on some boards counting it would score a phantom hand above the real ceiling.",
    "zh": "范围是示例输入（reference）；“范围最强手”“牌面可达上限”与 is_capped 由评估器逐组合现算（derived）。上限取“还发得出来”的那些组合的最优（翻牌圈 1176 个，五张牌面后 1081 个），所以 capped 说的是“不在我这一份范围里”，不是“这张牌面上不可能出现”。用到牌面已有牌的组合发不出来，因此不计入——有些牌面上把它算进来会得到一个比真正上限更高的幻影牌型。"
  },
  "checks": [
    {
      "detail": "the table contains both a capped and an uncapped line; if every row agreed, the verdict would be meaningless",
      "kind": "frequency_bounds",
      "pass": true
    }
  ],
  "columns": [
    {
      "header": {
        "en": "Board",
        "zh": "牌面"
      },
      "key": "board",
      "unit": "dimensionless"
    },
    {
      "header": {
        "en": "Role",
        "zh": "角色"
      },
      "key": "role",
      "unit": "dimensionless"
    },
    {
      "digits": 1,
      "header": {
        "en": "Combos",
        "zh": "组合数"
      },
      "key": "combos",
      "unit": "combos"
    },
    {
      "header": {
        "en": "Best in range",
        "zh": "范围最强手"
      },
      "key": "range_best",
      "unit": "dimensionless"
    },
    {
      "header": {
        "en": "Board ceiling",
        "zh": "牌面可达上限"
      },
      "key": "ceiling",
      "unit": "dimensionless"
    },
    {
      "header": {
        "en": "Capped?",
        "zh": "是否封顶"
      },
      "key": "is_capped",
      "unit": "dimensionless"
    }
  ],
  "id": "table.03-02.capped-range-check",
  "lesson": "03-02",
  "markdown": null,
  "provenance": {
    "assumptions": [
      {
        "en": "Capped means the range's best holding sits below the board's reachable ceiling by more than `tolerance`, counted in units of the evaluator's packed integer score -- not in hand types: adjacent distinct strengths can sit 16 units apart, while a hand-type step here is 184,320 units or more. The default tolerance is 0.",
        "zh": "封顶的判定是：范围最强手比牌面可达上限低出超过 tolerance，单位是评估器打包整数分的刻度，不是牌型种类：相邻两种不同牌力可以只差 16 个刻度，而一档牌型差距在这里是 184,320 个刻度起步。tolerance 默认为 0。"
      },
      {
        "en": "Ranges are narrowed to the board with notation.parse(spec, exclude=board) before they are measured, so `Combos` is the number of deals that are still possible; `is_capped` refuses a range that still contains a board card.",
        "zh": "范围先经 notation.parse(spec, exclude=board) 按牌面收缩再测量，`组合数` 一列是仍然可发的牌数；`is_capped` 会拒绝仍含牌面那张卡的范围。"
      }
    ],
    "confidence": "high",
    "derivation_ref": "pokergto.theory.range_advantage#is_capped",
    "kind": "derived",
    "license": "CC-BY-SA-4.0",
    "solver_run": null,
    "upstream": null,
    "verified": true
  },
  "rows": [
    {
      "board": "Kh7s3d",
      "ceiling": {
        "en": "three of a kind K 7 3",
        "zh": "三条 K 7 3"
      },
      "combos": 44.0,
      "is_capped": true,
      "range_best": {
        "en": "three of a kind 7 K 3",
        "zh": "三条 7 K 3"
      },
      "role": "hero",
      "spec": "AKs,AQs,ATs,KQs,AKo,AQo,99,77"
    },
    {
      "board": "Kh7s3d",
      "ceiling": {
        "en": "three of a kind K 7 3",
        "zh": "三条 K 7 3"
      },
      "combos": 58.0,
      "is_capped": true,
      "range_best": {
        "en": "one pair K Q 7 3",
        "zh": "一对 K Q 7 3"
      },
      "role": "villain",
      "spec": "KJs,QJs,JTs,T9s,98s,A5s-A2s,KQo,AJo,76s"
    },
    {
      "board": "AsKsQh",
      "ceiling": {
        "en": "straight A",
        "zh": "顺子 A"
      },
      "combos": 65.0,
      "is_capped": false,
      "range_best": {
        "en": "straight A",
        "zh": "顺子 A"
      },
      "role": "hero",
      "spec": "AA,KK,QQ,JT,T9,AT,KT"
    },
    {
      "board": "AsKsQh",
      "ceiling": {
        "en": "straight A",
        "zh": "顺子 A"
      },
      "combos": 80.0,
      "is_capped": true,
      "range_best": {
        "en": "one pair K A Q 9",
        "zh": "一对 K A Q 9"
      },
      "role": "villain",
      "spec": "98s,76s,54s,65,K9,K8,Q9,J9"
    },
    {
      "board": "9h6d3c",
      "ceiling": {
        "en": "three of a kind 9 6 3",
        "zh": "三条 9 6 3"
      },
      "combos": 63.0,
      "is_capped": false,
      "range_best": {
        "en": "three of a kind 9 6 3",
        "zh": "三条 9 6 3"
      },
      "role": "hero",
      "spec": "AKo,AQo,AJs,KQo,TT,99,88,AKs,AQs"
    },
    {
      "board": "9h6d3c",
      "ceiling": {
        "en": "three of a kind 9 6 3",
        "zh": "三条 9 6 3"
      },
      "combos": 48.0,
      "is_capped": true,
      "range_best": {
        "en": "three of a kind 6 9 3",
        "zh": "三条 6 9 3"
      },
      "role": "villain",
      "spec": "87s,76s,65s,54s,T8s,T9s,98o,97o,66,55"
    }
  ],
  "schema_version": "1.0.0",
  "source": {
    "args": {},
    "function": "is_capped",
    "generator": "tools/gen_tables.py",
    "module": "pokergto.theory.range_advantage",
    "seed": null
  },
  "title": {
    "en": "Capped-range check: does this line contain the nuts",
    "zh": "范围封顶检查：这条线里有没有坚果"
  },
  "unverified_claims": []
}
